{"attestation":{"algorithm":"Ed25519","keyId":"protocol.author.provider-os.test-ed25519","signature":"iNmRbrKSUY-2aUQOlvdpgL4p7YbgsWYzXYMRJiO8k90LBnCGuQvP-DOiOkwkkjzUWeWIWbxbEuSxJwgTihzbAA"},"budgetFreezeId":"bf-sha256:09d3dfeffb15d2e4e362559b60101c23406a6c3c55a0988b0722847108032e33","createdAt":"2026-07-31T00:00:00.000Z","createdBy":{"identityDigest":"sha256:7340e443efd5443758dbdbb6f78e1d1b79cb4ae8d778b51c276aa8867bf4f3ac","implementationDigest":"sha256:1111111111111111111111111111111111111111111111111111111111111111","instanceId":"protocol.author.provider-os.instance","principalId":"protocol.author.provider-os","role":"protocol_author"},"datasetPermissions":["deterministic"],"environmentHash":"sha256:6666666666666666666666666666666666666666666666666666666666666666","hashDomain":"BudgetFreezeManifest.v1","methods":["B0"],"modelIdentityHash":"sha256:185c019fc0bd443295b659635b7fb88ced8b933dea4ac5e9e6c894558d63be09","perRequestCostCapMicros":100,"perRequestTokenCap":100,"permissionPolicyHash":"sha256:4444444444444444444444444444444444444444444444444444444444444444","phaseCaps":[{"caps":{"feedbackEvents":0,"outputBytes":100000,"processCount":1,"providerCostMicros":100,"providerModelRequestAttempts":1,"toolAttempts":0,"totalChargedTokens":100,"wallClockMillis":10000},"phaseId":"mine_trace_generation"},{"caps":{"feedbackEvents":0,"outputBytes":100000,"processCount":1,"providerCostMicros":100,"providerModelRequestAttempts":1,"toolAttempts":0,"totalChargedTokens":100,"wallClockMillis":10000},"phaseId":"evidence_summarization"},{"caps":{"feedbackEvents":0,"outputBytes":100000,"processCount":1,"providerCostMicros":100,"providerModelRequestAttempts":1,"toolAttempts":0,"totalChargedTokens":100,"wallClockMillis":10000},"phaseId":"weakness_mining"},{"caps":{"feedbackEvents":0,"outputBytes":100000,"processCount":1,"providerCostMicros":100,"providerModelRequestAttempts":1,"toolAttempts":0,"totalChargedTokens":100,"wallClockMillis":10000},"phaseId":"attribution"},{"caps":{"feedbackEvents":0,"outputBytes":100000,"processCount":1,"providerCostMicros":100,"providerModelRequestAttempts":1,"toolAttempts":0,"totalChargedTokens":100,"wallClockMillis":10000},"phaseId":"proposal"},{"caps":{"feedbackEvents":0,"outputBytes":100000,"processCount":1,"providerCostMicros":100,"providerModelRequestAttempts":1,"toolAttempts":0,"totalChargedTokens":100,"wallClockMillis":10000},"phaseId":"static_validation"},{"caps":{"feedbackEvents":0,"outputBytes":100000,"processCount":1,"providerCostMicros":100,"providerModelRequestAttempts":1,"toolAttempts":0,"totalChargedTokens":100,"wallClockMillis":10000},"phaseId":"gate_evaluation"},{"caps":{"feedbackEvents":0,"outputBytes":100000,"processCount":1,"providerCostMicros":100,"providerModelRequestAttempts":1,"toolAttempts":0,"totalChargedTokens":100,"wallClockMillis":10000},"phaseId":"gate_selection"},{"caps":{"feedbackEvents":0,"outputBytes":100000,"processCount":1,"providerCostMicros":100,"providerModelRequestAttempts":1,"toolAttempts":0,"totalChargedTokens":100,"wallClockMillis":10000},"phaseId":"offline_canary"},{"caps":{"feedbackEvents":0,"outputBytes":100000,"processCount":1,"providerCostMicros":100,"providerModelRequestAttempts":1,"toolAttempts":0,"totalChargedTokens":100,"wallClockMillis":10000},"phaseId":"track_a_task_search"},{"caps":{"feedbackEvents":0,"outputBytes":100000,"processCount":1,"providerCostMicros":100,"providerModelRequestAttempts":1,"toolAttempts":0,"totalChargedTokens":100,"wallClockMillis":10000},"phaseId":"final_solving"},{"caps":{"feedbackEvents":0,"outputBytes":100000,"processCount":1,"providerCostMicros":100,"providerModelRequestAttempts":1,"toolAttempts":0,"totalChargedTokens":100,"wallClockMillis":10000},"phaseId":"temporal_replication"},{"caps":{"feedbackEvents":0,"outputBytes":100000,"processCount":1,"providerCostMicros":100,"providerModelRequestAttempts":1,"toolAttempts":0,"totalChargedTokens":100,"wallClockMillis":10000},"phaseId":"provider_smoke"}],"protocolId":"protocol-sha256:eeeeeeeeeeeeeeeeeeeeeeeeeeeeeeeeeeeeeeeeeeeeeeeeeeeeeeeeeeeeeeee","rolloutSeeds":[1729],"schemaVersion":1,"scope":"provider_smoke","solverSlots":[{"methodId":"B0","slots":1}],"sourceConfigHash":"sha256:7777777777777777777777777777777777777777777777777777777777777777","supersedesBudgetFreezeId":null,"toolSetHash":"sha256:5555555555555555555555555555555555555555555555555555555555555555"}